{
  "assurance": [],
  "capabilities": [],
  "component": {
    "id": "nominalsubtypes@1.0.0",
    "name": "nominalsubtypes",
    "version": "1.0.0"
  },
  "declarations": [
    {
      "assurance": [],
      "capabilities": [],
      "documentation": {
        "details": "",
        "summary": "Independent corpus contract."
      },
      "effects": [],
      "failure": {
        "errors": [],
        "mode": "none",
        "unexpected": "poison-runtime"
      },
      "id": "lean:NominalSubtypes.arrayValues",
      "kind": "function",
      "mutability": "immutable",
      "name": "arrayValues",
      "overloadKey": "NominalSubtypes.arrayValues",
      "owner": null,
      "parameters": [
        {
          "default": null,
          "lifetime": null,
          "mutability": "immutable",
          "name": "value0",
          "optional": false,
          "ownership": "copy",
          "type": {
            "kind": "primitive",
            "name": "nat"
          }
        }
      ],
      "receiver": null,
      "result": {
        "lifetime": null,
        "ownership": "copy",
        "type": {
          "arguments": [
            {
              "kind": "primitive",
              "name": "nat"
            }
          ],
          "constructor": "array",
          "kind": "apply"
        }
      },
      "resultMode": "value",
      "source": {
        "declaration": "NominalSubtypes.arrayValues",
        "extensions": {
          "lean-lang.org/refinements": {
            "parameters": [
              null
            ],
            "result": {
              "arguments": [
                {
                  "constructor": null,
                  "kind": "subtype"
                }
              ],
              "kind": "array"
            }
          },
          "lean-lang.org/source-position": {
            "endColumn": 85,
            "endLine": 59,
            "path": "NominalSubtypes.lean",
            "startColumn": 0,
            "startLine": 59
          },
          "lean-lang.org/theorem-references": []
        },
        "producer": "lean"
      },
      "typeParameters": []
    },
    {
      "assurance": [],
      "capabilities": [],
      "documentation": {
        "details": "",
        "summary": "Independent corpus contract."
      },
      "effects": [],
      "failure": {
        "errors": [],
        "mode": "none",
        "unexpected": "poison-runtime"
      },
      "id": "lean:NominalSubtypes.branch",
      "kind": "function",
      "mutability": "immutable",
      "name": "branch",
      "overloadKey": "NominalSubtypes.branch",
      "owner": null,
      "parameters": [
        {
          "default": null,
          "lifetime": null,
          "mutability": "immutable",
          "name": "value0",
          "optional": false,
          "ownership": "copy",
          "type": {
            "kind": "primitive",
            "name": "nat"
          }
        }
      ],
      "receiver": null,
      "result": {
        "lifetime": null,
        "ownership": "copy",
        "type": {
          "arguments": [
            {
              "kind": "primitive",
              "name": "nat"
            },
            {
              "kind": "primitive",
              "name": "nat"
            }
          ],
          "constructor": "result",
          "kind": "apply"
        }
      },
      "resultMode": "value",
      "source": {
        "declaration": "NominalSubtypes.branch",
        "extensions": {
          "lean-lang.org/refinements": {
            "parameters": [
              null
            ],
            "result": {
              "arguments": [
                {
                  "constructor": null,
                  "kind": "subtype"
                },
                {
                  "constructor": null,
                  "kind": "subtype"
                }
              ],
              "kind": "result"
            }
          },
          "lean-lang.org/source-position": {
            "endColumn": 66,
            "endLine": 64,
            "path": "NominalSubtypes.lean",
            "startColumn": 0,
            "startLine": 63
          },
          "lean-lang.org/theorem-references": []
        },
        "producer": "lean"
      },
      "typeParameters": []
    },
    {
      "assurance": [],
      "capabilities": [],
      "documentation": {
        "details": "",
        "summary": "Independent corpus contract."
      },
      "effects": [],
      "failure": {
        "errors": [],
        "mode": "none",
        "unexpected": "poison-runtime"
      },
      "id": "lean:NominalSubtypes.eventChoices",
      "kind": "function",
      "mutability": "immutable",
      "name": "eventChoices",
      "overloadKey": "NominalSubtypes.eventChoices",
      "owner": null,
      "parameters": [
        {
          "default": null,
          "lifetime": null,
          "mutability": "immutable",
          "name": "value0",
          "optional": false,
          "ownership": "copy",
          "type": {
            "kind": "primitive",
            "name": "nat"
          }
        }
      ],
      "receiver": null,
      "result": {
        "lifetime": null,
        "ownership": "copy",
        "type": {
          "id": "lean:NominalSubtypes.Event",
          "kind": "named"
        }
      },
      "resultMode": "value",
      "source": {
        "declaration": "NominalSubtypes.eventChoices",
        "extensions": {
          "lean-lang.org/refinements": {
            "parameters": [
              null
            ],
            "result": {
              "cases": [
                {
                  "fields": [],
                  "name": "empty"
                },
                {
                  "fields": [
                    {
                      "name": "value",
                      "refinement": {
                        "fields": [
                          {
                            "name": "payload",
                            "refinement": {
                              "constructor": null,
                              "kind": "subtype"
                            }
                          },
                          {
                            "name": "digit",
                            "refinement": {
                              "bound": "3",
                              "kind": "fin"
                            }
                          }
                        ],
                        "kind": "record",
                        "name": "NominalSubtypes.Envelope"
                      }
                    }
                  ],
                  "name": "box"
                },
                {
                  "fields": [
                    {
                      "name": "values",
                      "refinement": {
                        "arguments": [
                          {
                            "arguments": [
                              {
                                "arguments": [
                                  {
                                    "constructor": null,
                                    "kind": "subtype"
                                  },
                                  {
                                    "constructor": null,
                                    "kind": "subtype"
                                  }
                                ],
                                "kind": "result"
                              }
                            ],
                            "kind": "option"
                          }
                        ],
                        "kind": "array"
                      }
                    }
                  ],
                  "name": "choices"
                }
              ],
              "kind": "variant",
              "name": "NominalSubtypes.Event"
            }
          },
          "lean-lang.org/source-position": {
            "endColumn": 121,
            "endLine": 69,
            "path": "NominalSubtypes.lean",
            "startColumn": 0,
            "startLine": 69
          },
          "lean-lang.org/theorem-references": []
        },
        "producer": "lean"
      },
      "typeParameters": []
    },
    {
      "assurance": [],
      "capabilities": [],
      "documentation": {
        "details": "",
        "summary": "Independent corpus contract."
      },
      "effects": [],
      "failure": {
        "errors": [],
        "mode": "none",
        "unexpected": "poison-runtime"
      },
      "id": "lean:NominalSubtypes.eventEmpty",
      "kind": "function",
      "mutability": "immutable",
      "name": "eventEmpty",
      "overloadKey": "NominalSubtypes.eventEmpty",
      "owner": null,
      "parameters": [
        {
          "default": null,
          "lifetime": null,
          "mutability": "immutable",
          "name": "value0",
          "optional": false,
          "ownership": "copy",
          "type": {
            "kind": "primitive",
            "name": "nat"
          }
        }
      ],
      "receiver": null,
      "result": {
        "lifetime": null,
        "ownership": "copy",
        "type": {
          "id": "lean:NominalSubtypes.Event",
          "kind": "named"
        }
      },
      "resultMode": "value",
      "source": {
        "declaration": "NominalSubtypes.eventEmpty",
        "extensions": {
          "lean-lang.org/refinements": {
            "parameters": [
              null
            ],
            "result": {
              "cases": [
                {
                  "fields": [],
                  "name": "empty"
                },
                {
                  "fields": [
                    {
                      "name": "value",
                      "refinement": {
                        "fields": [
                          {
                            "name": "payload",
                            "refinement": {